{
  "created_at": "2026-06-13T05:08:44.743780+00:00",
  "environment": {
    "cwd": "C:\\Users\\jcthi\\Code\\brain",
    "machine": "AMD64",
    "platform": "Windows-10-10.0.26200-SP0",
    "processor": "AMD64 Family 25 Model 97 Stepping 2, AuthenticAMD",
    "python": "3.11.9"
  },
  "git_commit": "7ffa5ad9b4ebedae0bee0691a09dedb0613156eb",
  "hashes": {
    "benchmark\\runners\\run_contamination_scan.py": "a9087e6dfa78c090e63d6bf4a12189b9789f0938652e8401556617dd97dac533"
  },
  "notes": "Contamination scan tooling exists. Unknown contamination is not clean.",
  "schema_version": "1.0",
  "source_paths": [
    "benchmark/runners/run_contamination_scan.py"
  ]
}