{
  "created_at": "2026-06-13T04:44:35.094390+00:00",
  "environment": {
    "cwd": "/workspace",
    "machine": "x86_64",
    "platform": "Linux-6.6.87.2-microsoft-standard-WSL2-x86_64-with-glibc2.35",
    "processor": "x86_64",
    "python": "3.10.13"
  },
  "git_commit": "7ffa5ad9b4ebedae0bee0691a09dedb0613156eb",
  "hashes": {
    "benchmark/configs/generated/benchmark_100m_suite.yaml": "e34d3dc94f96d285a65b4136a8d7a54aacdd2fe3f230a7373a8d47259ab19a32"
  },
  "notes": "Suite execution reproducibility manifest.",
  "schema_version": "1.0",
  "source_paths": [
    "benchmark/configs/generated/benchmark_100m_suite.yaml"
  ]
}